ID,Imagen,Nombre del producto,Descripción
B1,LUMEN 4336W.png,LUMEN 4336W,"El Varex LUMEN 4336W es un detector de panel plano liviano diseñado para sistemas de radiografía digital. El nuevo LUMEN 4336W ha sido diseñado con fiabilidad y robustez en mente. La reconocida calidad de imagen de Varex Imaging ahora viene en un paquete que puede soportar mejor los desafíos del departamento de emergencias, incluidos los ciclos de desinfección más frecuentes exigidos por los estándares de atención en evolución. "
B2,Maquina De Rayos X SEDECAL Dragon.png,Maquina De Rayos X SEDECAL Dragon,"La SEDECAL Dragon es una máquina de rayos X portátil, ideal para obtener imágenes radiológicas en áreas de difícil acceso o en pacientes con movilidad limitada. Su diseño compacto con ruedas facilita su transporte, mientras que su brazo ajustable permite posicionar el tubo de rayos X en diferentes ángulos. Funciona con baterías recargables, lo que la hace versátil para hospitales, clínicas y entornos de emergencia. "
B3,Sistema de rayox x Americomp.png,Sistema de rayox x Americomp,"En comparación con los generadores convencionales de 60 Hertz, la tecnología de alta frecuencia produce más rayos X en menos tiempo. La reducción del tiempo de exposición minimizará la borrosidad de la imagen causada por el movimiento.<br><br> Al producir kV más efectivos, la tecnología HF mejora la potencia de penetración, lo que permite ajustes de kV más bajos. La radiación dispersa resultante se minimiza, eliminando películas grises empañadas.<br><br> El panel de control montado en la parte delantera proporciona información importante sobre la exposición y fácil acceso para personas de cualquier altura. Completamente sellado de fluidos animales. 
"
B4,Sistema de Rayos X TXR.png,Sistema de Rayos X TXR,"El Sistema de Rayos X TXR es un equipo radiológico diseñado para ofrecer imágenes de alta calidad con precisión diagnóstica. Ideal para una amplia gama de estudios, su versatilidad y confiabilidad lo hacen adecuado para hospitales y clínicas, proporcionando un rendimiento eficiente en un diseño robusto y fácil de usar. "
B5,AIR DRC P Innovative Direct Radiography.png,AIR DRC P Innovative Direct Radiography,"Este sistema de radiografía digital directa de ICRCO ofrece un flujo de trabajo optimizado con una rápida captura de imágenes y una calidad de imagen excepcional. Diseñado para maximizar la productividad en entornos clínicos, el AIR DRC P combina innovación y confiabilidad. "
B6,AMRAD MEDICAL FMT Classic.png,AMRAD MEDICAL,"Sistema de máquina de rayos X estacionaria Amrad/Summit. Generadores de Alta Frecuencia Serie E. 30 kW - Monofásico y Trifásico, 42 kW - Monofásico y Trifásico, 52 kW - Trifásico. Mesas Fijas, Elevadoras con Tapa Flotante. Soporte de tubo montado en el suelo, soportes de pared, soporte de pared Bucky. Serie DR. "
B7,FWFC Classic System TXR.png,FWFC Classic System ,"El Sistema FWFC Classic puede configurarse para satisfacer las necesidades de cualquier departamento. Este sistema completo de piso a pared/techo está disponible con rieles de 8 pies o la opción de 10 pies para realizar estudios con carga de peso. Además, el Sistema FWFC Classic incluye una garantía de piezas líder en la industria de 5 años. "
